question,topic,configuration,reference_answer,candidate_answer,accuracy,completeness,citation_quality,relevance,overall,justification
Quels sont les principaux enjeux géopolitiques dans la région du Caucase ?,points_chauds,Simple Prompt,"Le Caucase est une zone charnière entre Europe, Russie, Moyen-Orient et Asie centrale, marquée par des rivalités d'influence (Russie, Turquie, Iran, Occident), des conflits autour des frontières et des minorités, ainsi que par des enjeux énergétiques et de corridors de transport.","Les principaux enjeux géopolitiques dans le Caucase incluent :

1. **Conflits territoriaux** : Tensions entre Arménie et Azerbaïdjan (Haut-Karabakh), entre la Géorgie et la Russie (Abkhazie, Ossétie du Sud).
2. **Influence des puissances extérieures** : Rivalité entre la Russie, la Turquie, l'Iran et l'UE/OTAN.
3. **Ressources énergétiques** : Contrôle des pipelines (BTC, South Caucasus Pipeline) et gaz naturel.
4. **Stabilité régionale** : Fragilité des États post-soviétiques et risques de radicalisation.
5. **Désenclavement** : Projets de corridors (comme le corridor Zangezur) pour relier l'Asie centrale à l'Europe.

Ces enjeux mêlent sécurité, économie et rivalités stratégiques.",5,5,5,5,5,"La réponse candidate est très précise, couvre tous les enjeux majeurs et cite des exemples concrets (Haut-Karabakh, pipelines BTC). Elle est parfaitement pertinente et complète par rapport à la référence."
Quels sont les principaux enjeux géopolitiques dans la région du Caucase ?,points_chauds,Basic RAG,"Le Caucase est une zone charnière entre Europe, Russie, Moyen-Orient et Asie centrale, marquée par des rivalités d'influence (Russie, Turquie, Iran, Occident), des conflits autour des frontières et des minorités, ainsi que par des enjeux énergétiques et de corridors de transport.","Voici les principaux enjeux géopolitiques dans la région du Caucase, expliqués de manière claire et structurée :

---

**1. Tensions entre héritage russe et influence européenne**
Les pays du Caucase (Géorgie, Arménie, Azerbaïdjan) sont tiraillés entre leur passé soviétique et leur volonté de se rapprocher de l’Union européenne. Par exemple, en Géorgie, les manifestations de 2023 contre une loi jugée pro-russe illustrent cette rivalité d’influences [Page 40].
Cette situation crée des divisions internes et fragilise la stabilité politique.

---

**2. Conflits territoriaux non résolus**
L’effondrement de l’URSS en 1991 a laissé des frontières internes mal définies, notamment pour les régions autonomes comme l’**Ossétie du Sud** et l’**Abkhazie** (en Géorgie). Ces territoires, soutenus par la Russie, revendiquent leur indépendance, ce qui alimente des conflits gelés ou ouverts [Page 41].
Le cas du **Haut-Karabakh** est emblématique : l’Azerbaïdjan, soutenu par la Turquie, a repris le contrôle de cette région en 2023 après des décennies de guerre avec l’Arménie [Page 38].

---

**3. Hétérogénéité ethnique et risques de fragmentation**
Le Caucase est une mosaïque de groupes ethniques et linguistiques (indo-européens, altaïques, caucasiques). Cette diversité, couplée à des frontières mal adaptées, favorise les tensions intercommunautaires et les revendications séparatistes [Page 40].
Par exemple, le nationalisme géorgien a exacerbé les crises en Ossétie du Sud et en Abkhazie [Page 41].

---

**4. Rivalités entre puissances régionales**
La région est un terrain de compétition entre :
- **La Russie**, qui maintient une influence forte (soutien aux séparatistes, bases militaires).
- **La Turquie**, alliée de l’Azerbaïdjan et acteur clé dans le conflit du Haut-Karabakh [Page 38].
- **L’Union européenne et les États-Unis**, qui cherchent à promouvoir la démocratie et l’intégration économique (ex. : accords d’association avec la Géorgie).

---

**5. Enjeux énergétiques et économiques**
Le Caucase est une zone stratégique pour le transit des hydrocarbures (pipelines reliant la mer Caspienne à l’Europe). Les tensions géopolitiques peuvent perturber ces flux, comme lors des conflits entre l’Arménie et l’Azerbaïdjan.

---
**À retenir** :
Ces enjeux se renforcent mutuellement : les conflits territoriaux alimentent les rivalités entre puissances, tandis que la diversité ethnique complique la construction d’États stables.

Si tu veux approfondir un point précis (ex. : le rôle de la Turquie ou les détails sur le Haut-Karabakh), n’hésite pas à demander. Sinon, ton professeur pourra t’aider à explorer d’autres aspects non couverts ici.",5,5,4,5,5,"La réponse candidate est très précise et couvre tous les enjeux majeurs mentionnés dans la référence, avec des détails supplémentaires pertinents. Les citations sont bien intégrées, bien que leur format (ex. [Page 40]) soit moins standard que des références académiques. La réponse est parfaitement adaptée à la question."
Quels sont les principaux enjeux géopolitiques dans la région du Caucase ?,points_chauds,Advanced RAG,"Le Caucase est une zone charnière entre Europe, Russie, Moyen-Orient et Asie centrale, marquée par des rivalités d'influence (Russie, Turquie, Iran, Occident), des conflits autour des frontières et des minorités, ainsi que par des enjeux énergétiques et de corridors de transport.","Voici les principaux enjeux géopolitiques dans la région du Caucase, d'après ton manuel :

**1. Tensions entre héritage russe et aspirations européennes**
La région est marquée par un clivage entre l’influence historique de la Russie et le désir de certains pays de se rapprocher de l’Europe. Par exemple, la Géorgie est secouée par des manifestations contre une loi jugée pro-russe, tandis que des débats existent sur une éventuelle adhésion à l’OTAN [Page 40].

**2. Conflits territoriaux non résolus**
Les frontières entre l’Arménie et l’Azerbaïdjan restent une source de tensions récurrentes, avec des risques de résurgence de conflits comme celui du Haut-Karabakh [Page 40].

**3. Influence des puissances extérieures**
La région est un terrain de rivalité entre grandes puissances (Russie, États-Unis, Union européenne, Turquie). La question d’une adhésion de la Géorgie à l’OTAN, par exemple, illustre cette compétition [Page 19].

**4. Instabilité politique interne**
Certains pays du Caucase, comme la Géorgie, connaissent des mouvements de protestation contre leurs gouvernements, reflétant des divisions internes sur leur orientation géopolitique [Page 40].

Si tu veux approfondir un point précis (comme le conflit du Haut-Karabakh ou le rôle de la Russie), je t’invite à consulter ton professeur, car ces détails ne sont pas développés dans ton manuel.

CITES: Page: 19,40",5,4,3,5,4,"La réponse candidate est globalement exacte et pertinente, couvrant les principaux enjeux géopolitiques du Caucase. Cependant, elle manque de complétude sur certains aspects (comme les enjeux énergétiques ou les corridors de transport) et les citations manquent de précision (références aux pages sans contexte)."
Décrivez les tensions actuelles autour de Taïwan et leurs implications régionales.,points_chauds,Simple Prompt,"Les tensions autour de Taïwan opposent la Chine, qui revendique l'île, aux États-Unis et à leurs partenaires qui soutiennent de facto son autonomie, ce qui alimente une course aux armements en Asie de l'Est et renforce les alliances régionales de sécurité.","Les tensions autour de Taïwan opposent la Chine, qui revendique l'île comme partie intégrante de son territoire, et Taïwan, qui fonctionne comme un État de facto indépendant. La Chine renforce sa pression militaire (exercices, menaces) et diplomatique, tandis que Taïwan reçoit un soutien accru des États-Unis (ventes d'armes, visites de responsables). Ces tensions affectent la stabilité régionale, notamment en mer de Chine méridionale, et risquent d'entraîner une escalade militaire impliquant les États-Unis et leurs alliés (Japon, Australie). La situation influence aussi les relations sino-américaines et les dynamiques géopolitiques en Asie-Pacifique.",5,5,4,5,5,"La réponse candidate est très précise et couvre tous les aspects clés des tensions autour de Taïwan, y compris les acteurs impliqués, les actions militaires et diplomatiques, et les implications régionales. Elle est pertinente et bien structurée, bien que les citations manquent de sources explicites."
Décrivez les tensions actuelles autour de Taïwan et leurs implications régionales.,points_chauds,Basic RAG,"Les tensions autour de Taïwan opposent la Chine, qui revendique l'île, aux États-Unis et à leurs partenaires qui soutiennent de facto son autonomie, ce qui alimente une course aux armements en Asie de l'Est et renforce les alliances régionales de sécurité.","Voici une explication structurée des tensions actuelles autour de Taïwan et de leurs implications régionales, basée sur les informations disponibles dans ton manuel :

---

**1. Origine des tensions : une question de souveraineté**
La Chine considère Taïwan comme une province rebelle qu’elle souhaite ""réunifier"" avec le continent, par la force si nécessaire. Cette position remonte à la guerre civile chinoise (1949), lorsque les nationalistes du Kuomintang, vaincus par les communistes, se sont réfugiés sur l’île. Pékin n’a jamais renoncé à cette revendication, comme le rappelle la loi anti-sécession de 2005, qui autorise l’usage de la force en cas de déclaration formelle d’indépendance par Taïwan [Page 30].

**2. Escalade récente des tensions**
Les tensions se sont aggravées depuis 2022 pour plusieurs raisons :
- **Manœuvres militaires chinoises** : Pékin multiplie les exercices militaires dans le détroit de Taïwan, simulant des blocus ou des invasions. Ces démonstrations de force visent à intimider l’île et à tester les réactions internationales [Page 31].
- **Élections taïwanaises** : Les scrutins, comme celui de janvier 2024, sont perçus comme des provocations par la Chine, surtout si un candidat pro-indépendance l’emporte. Pékin craint que Taïwan ne s’éloigne durablement de son giron [Page 30].
- **Guerre en Ukraine** : Ce conflit a ravivé les craintes d’une invasion chinoise, même si les États-Unis ont réaffirmé leur engagement à défendre Taïwan (sans préciser si cela inclurait une intervention militaire) [Page 31].

**3. Implications régionales**
- **Risque de conflit** : 40 % des Taïwanais redoutent une guerre dans les dix prochaines années, selon un sondage de 2022. Cette peur reflète l’incertitude géopolitique, même si une invasion chinoise reste incertaine (coût militaire et économique élevé) [Page 34].
- **Alliances stratégiques** : Les États-Unis soutiennent Taïwan militairement (ventes d’armes) et diplomatiquement, ce qui irrite la Chine. D’autres pays, comme le Japon ou l’Australie, pourraient être entraînés dans un conflit en raison de leurs liens avec Washington [Page 31].
- **Stabilité économique** : Taïwan est un acteur clé des chaînes de production mondiales (semi-conducteurs, technologie). Un conflit perturberait gravement l’économie régionale et mondiale [Page 34].

**4. Enjeux pour l’avenir**
La situation dépendra de plusieurs facteurs :
- L’évolution du rapport de forces militaire entre la Chine et les États-Unis.
- Le résultat des élections taïwanaises et les choix politiques de l’île (rapprochement ou éloignement avec Pékin).
- La réaction de la communauté internationale, notamment en cas d’escalade.

---

**Remarque** :
Ton manuel ne détaille pas les positions des autres pays asiatiques (comme la Corée du Sud ou les pays de l’ASEAN) ni les aspects juridiques du statut de Taïwan. Pour approfondir ces points, je te conseille d’en parler avec ton professeur ou de consulter des sources complémentaires.",5,5,4,5,5,"La réponse candidate est très précise et couvre tous les aspects clés des tensions autour de Taïwan, avec des détails pertinents sur les origines, l'escalade récente et les implications régionales. Les citations sont bien intégrées, bien que la mention des pages du manuel soit un peu formelle. La réponse est parfaitement pertinente pour la question posée."
Décrivez les tensions actuelles autour de Taïwan et leurs implications régionales.,points_chauds,Advanced RAG,"Les tensions autour de Taïwan opposent la Chine, qui revendique l'île, aux États-Unis et à leurs partenaires qui soutiennent de facto son autonomie, ce qui alimente une course aux armements en Asie de l'Est et renforce les alliances régionales de sécurité.","Voici une explication claire et structurée des tensions actuelles autour de Taïwan et de leurs implications régionales, basée uniquement sur les informations disponibles dans ton manuel.

---

**1. Origine des tensions : la relation Taïwan-Chine**
Taïwan est au cœur d’un conflit territorial et politique avec la Chine continentale. Pékin considère Taïwan comme une province rebelle qui doit être réunifiée, par la force si nécessaire. Cette position s’est durcie ces dernières années, notamment avec les **manœuvres militaires chinoises dans le détroit de Taïwan en 2022** [Page 31]. Ces exercices visent à intimider l’île et à tester sa capacité de résistance.

**2. Rôle des États-Unis et enjeux géopolitiques**
Les tensions sont amplifiées par l’implication des États-Unis, qui soutiennent Taïwan militairement et politiquement. Le président américain a **réaffirmé sa détermination à défendre Taïwan en cas d’agression chinoise** [Page 31]. Cette garantie, bien que floue sur le plan juridique, crée un équilibre précaire :
- Pour la Chine, elle est perçue comme une ingérence dans ses affaires intérieures.
- Pour Taïwan, elle est une assurance contre une invasion.
- Pour les États-Unis, c’est un moyen de contenir l’influence chinoise en Asie-Pacifique.

**3. Implications régionales**
Ces tensions ont des répercussions majeures en Asie de l’Est :
- **Risque d’escalade militaire** : Une attaque chinoise sur Taïwan pourrait déclencher un conflit régional impliquant les États-Unis, le Japon, ou d’autres alliés américains (comme l’Australie).
- **Instabilité économique** : Le détroit de Taïwan est une route maritime cruciale pour le commerce mondial. Un blocage ou un conflit perturberait les chaînes d’approvisionnement, notamment pour les semi-conducteurs (Taïwan en produit 60 % des besoins mondiaux).
- **Effet d’entraînement** : D’autres pays asiatiques (comme le Japon ou les Philippines) pourraient renforcer leur coopération militaire avec les États-Unis, ce qui accroîtrait les divisions en Asie.

**4. Contexte international : la guerre en Ukraine comme référence**
La guerre en Ukraine sert de **point de comparaison** [Page 31]. Pékin observe la réaction occidentale à cette invasion pour évaluer les risques d’une action contre Taïwan. Si les sanctions contre la Russie ont été sévères, une attaque chinoise pourrait avoir des conséquences encore plus graves, compte tenu du poids économique de la Chine.

**5. Désinformation et propagande**
Les tensions autour de Taïwan sont aussi alimentées par des **campagnes de désinformation** [Page 100]. Les régimes autoritaires (comme la Chine) utilisent les réseaux sociaux pour influencer l’opinion publique, notamment en Occident. Cela complique la gestion diplomatique du conflit et polarise les débats.

---

**Ce que ton manuel ne précise pas** :
- Les détails des manœuvres militaires chinoises (nombre de navires, types d’exercices).
- Les positions exactes des autres pays asiatiques (Japon, Corée du Sud, etc.).
- Les scénarios précis d’une éventuelle intervention américaine.

Pour approfondir ces points, je te conseille de consulter ton professeur ou des sources complémentaires.

CITES: Page: 31,100",5,5,4,5,5,"La réponse candidate est très précise et couvre tous les aspects clés des tensions autour de Taïwan, avec des détails pertinents sur les enjeux géopolitiques et économiques. Les citations sont bien intégrées, bien que leur format soit un peu inhabituel. La réponse est parfaitement pertinente pour la question posée."
Quel est l'état actuel du conflit israélo-palestinien ?,points_chauds,Simple Prompt,"Le conflit israélo-palestinien reste caractérisé par l'absence de solution politique négociée, la poursuite de la colonisation, des cycles récurrents de violences, et une crise humanitaire grave dans les territoires palestiniens.","Le conflit israélo-palestinien reste un enjeu majeur au Moyen-Orient. Voici les éléments clés de la situation actuelle (2024) :

1. **Conflit armé** : Depuis octobre 2023, une guerre intense oppose Israël et le Hamas dans la bande de Gaza, déclenchée par l'attaque surprise du Hamas le 7 octobre. Les combats ont causé des milliers de morts (principalement palestiniens) et une grave crise humanitaire à Gaza.

2. **Occupation et colonisation** : Israël maintient son contrôle sur la Cisjordanie, où la colonisation israélienne se poursuit, malgré les condamnations internationales. Les tensions y restent vives, avec des violences régulières entre colons, soldats israéliens et Palestiniens.

3. **Statut de Jérusalem** : La ville est revendiquée comme capitale par Israël et les Palestiniens. Israël en contrôle la majeure partie, tandis que les Palestiniens cherchent à en faire la capitale d'un futur État.

4. **Diplomatie** : Les négociations de paix sont au point mort. Les propositions de cessez-le-feu et de reconstruction à Gaza sont bloquées par des désaccords sur les conditions (libération d'otages, désarmement du Hamas, etc.).

5. **Réactions internationales** : La communauté internationale est divisée. Certains pays (comme les États-Unis) soutiennent Israël, tandis que d'autres (comme la Turquie ou l'Afrique du Sud) critiquent ses actions. L'ONU et l'UE appellent à une solution à deux États, mais sans avancée concrète.

**En résumé** : Le conflit reste marqué par la violence, l'absence de perspective politique et une polarisation croissante.",5,5,4,5,5,"La réponse candidate est très précise et couvre tous les aspects clés du conflit, avec des détails actualisés (2024). Elle manque de citations directes mais reste bien structurée et pertinente. Elle dépasse même la référence en ajoutant des éléments contextuels (diplomatie, réactions internationales)."
Quel est l'état actuel du conflit israélo-palestinien ?,points_chauds,Basic RAG,"Le conflit israélo-palestinien reste caractérisé par l'absence de solution politique négociée, la poursuite de la colonisation, des cycles récurrents de violences, et une crise humanitaire grave dans les territoires palestiniens.","Voici l'état actuel du conflit israélo-palestinien selon les informations disponibles dans ton manuel :

**1. Un conflit toujours actif et meurtrier**
Le conflit reste une source majeure de tensions et de violences. Par exemple, au printemps 2023, 35 personnes sont mortes en 5 jours, dont 34 Palestiniens [Page 58].
Les affrontements armés récents entre Israël et la bande de Gaza remontent à août 2022, après ceux de 2021 [Page 58].

**2. Un contexte politique bloqué**
- **Côté israélien** : Le gouvernement formé après les élections de novembre 2022 est le plus à droite de l'histoire du pays. Cela rend difficile toute reprise des négociations avec les Palestiniens [Page 55].
- **Côté palestinien** : La division persiste entre le Hamas (qui contrôle Gaza) et le Fatah (qui dirige la Cisjordanie). Mahmoud Abbas, président de l'Autorité palestinienne, voit sa légitimité affaiblie en l'absence d'élections depuis 2006 (celles prévues en 2021 ont été reportées) [Page 58].

**3. Une marginalisation internationale du conflit**
- Les accords de normalisation entre Israël et certains pays arabes (comme les Accords d'Abraham) n'ont pas permis de faire avancer la résolution du conflit [Page 56].
- L'Union européenne, divisée sur la question, ne joue plus de rôle actif au Proche-Orient [Page 56].
- Les États-Unis, sous Joe Biden, continuent de soutenir la solution à deux États, mais sans avancée concrète [Page 56].

**4. Des tensions symboliques fortes**
Les provocations, comme les visites de responsables israéliens sur l'esplanade des Mosquées (3e lieu saint de l'islam), alimentent les tensions avec les Palestiniens et les pays arabes [Page 58].

**En résumé** : Le conflit reste gelé politiquement, mais les violences et les divisions internes empêchent toute avancée vers une solution durable.

Si tu veux approfondir un point précis (comme la solution à deux États ou le rôle des États-Unis), n'hésite pas à demander. Pour des mises à jour plus récentes (au-delà de 2023), je te conseille de te référer à ton professeur ou à des sources actualisées.",5,5,4,5,5,"La réponse candidate est très précise et couvre tous les aspects clés du conflit, avec des détails pertinents sur les violences, le contexte politique et les tensions internationales. Les citations sont bien intégrées, bien que leur format (référence à un manuel) soit moins standard que des sources directes. La réponse est parfaitement adaptée à la question posée."
Quel est l'état actuel du conflit israélo-palestinien ?,points_chauds,Advanced RAG,"Le conflit israélo-palestinien reste caractérisé par l'absence de solution politique négociée, la poursuite de la colonisation, des cycles récurrents de violences, et une crise humanitaire grave dans les territoires palestiniens.","Le conflit israélo-palestinien reste **actuellement une zone de tensions majeures** dans le monde, sans résolution en vue. Voici les éléments clés présents dans ton manuel :

1. **Un conflit toujours central**
   Le conflit n’est pas marginalisé : il continue d’occuper une place importante dans les relations internationales, malgré les tentatives de normalisation avec certains pays arabes [Page 55].

2. **Un contexte politique tendu en Israël**
   En novembre 2022, Israël a formé **le gouvernement le plus à droite de son histoire**, ce qui a exacerbé les tensions avec les Palestiniens. Ce gouvernement a relégué la question palestinienne au second plan, privilégiant la menace iranienne (notamment son programme nucléaire) [Page 55].

3. **Aucune solution politique en cours**
   Le manuel souligne que **le règlement de ce conflit reste indispensable** pour l’avenir d’Israël et de la région, mais aucune avancée concrète n’est mentionnée [Page 55].

---
**Attention** : Ton manuel ne donne **aucune information sur les événements postérieurs à 2022** (comme la guerre déclenchée en octobre 2023 par l’attaque du Hamas contre Israël). Pour une analyse actualisée, je te conseille de te référer à ton professeur ou à des sources récentes (comme des articles de presse fiables).

CITES: Page: 9,55",3,2,4,3,3,"La réponse candidate est partiellement exacte mais incomplète, car elle ne mentionne pas la colonisation ni la crise humanitaire, éléments clés du conflit. Les citations sont bien référencées, mais la réponse est datée (2022) et ignore des événements récents majeurs comme la guerre de 2023. La pertinence est moyenne car elle se concentre sur des aspects politiques sans aborder les dimensions humanitaires et territoriales."
Comment la guerre en Ukraine affecte-t-elle l'équilibre géopolitique mondial ?,points_chauds,Simple Prompt,"La guerre en Ukraine a renforcé la cohésion des alliés occidentaux, accentué la confrontation avec la Russie, accéléré le réalignement énergétique européen et rapproché davantage Moscou de puissances non occidentales comme la Chine, ce qui recompose l'équilibre mondial.","La guerre en Ukraine a plusieurs impacts géopolitiques majeurs :

1. **Renforcement de l'OTAN** : L'alliance s'est resserrée, avec un élargissement possible (Finlande, Suède).
2. **Affaiblissement de la Russie** : Isolement diplomatique, sanctions économiques et pertes militaires.
3. **Montée en puissance de la Chine** : Position ambiguë, renforcement des liens avec Moscou, mais prudence face aux sanctions.
4. **Crise énergétique en Europe** : Réduction de la dépendance au gaz russe, accélération des énergies renouvelables.
5. **Polarisation des alliances** : Affaiblissement des relations Russie-Occident, renforcement des blocs (OTAN vs. Chine/Russie).

Résultat : Un monde plus fragmenté, avec une rivalité croissante entre démocraties et régimes autoritaires.",5,5,5,5,5,"La réponse candidate est très précise et couvre tous les points clés de la réponse de référence, avec des détails supplémentaires pertinents. Elle est bien structurée et pertinente pour la question posée."
